{
  "protocol": 2, "request_id": "synthetic-run", "type": "run", "status": "ok",
  "message": "SYNTHETIC HEADER FIXTURE ONLY. No inference occurred; no binary payload or hardware evidence is included.",
  "outputs": {"mask": {"kind": "mask", "x": -7, "y": 11, "width": 3, "height": 2, "channels": 1, "color_mode": "gray", "source_depth": 32, "alpha": false, "data_section_index": 0}},
  "sections": [{"kind": "f32", "offset": 0, "length": 24}],
  "execution": {
    "requested_policy": {"mode": "auto", "allowed_backends": ["example.synthetic"], "allow_graph_fallback": false},
    "devices": [{"id": "example.synthetic.cpu", "kind": "cpu"}], "backend": "example.synthetic", "runtime_id": "example.synthetic", "runtime_version": "not-a-runtime",
    "resource": {"id": "example.synthetic.unavailable-model", "version": "0.0.0-example", "manifest_digest": "0000000000000000000000000000000000000000000000000000000000000000"},
    "configuration_digest": "0000000000000000000000000000000000000000000000000000000000000000",
    "graph_partitioned": false, "graph_fallback": false, "fallback_reason": null, "evidence": "synthetic_fixture",
    "timing": {"cpu_preprocess_ms": 0, "graph_execution_ms": 0, "cpu_postprocess_ms": 0, "total_ms": 0}
  }
}
